{
  "version": "1.0.0",
  "updated": "2025-11-01T00:00:00Z",
  "description": "Geopolitical Risk Assessment Data - Country-level cyber risk profiles",
  "countries": [
    {
      "id": "CR-001",
      "name": "Russia",
      "code": "RU",
      "region": "Europe",
      "riskScore": 95,
      "riskLevel": "critical",
      "factors": {
        "threatActorPresence": {
          "score": 40,
          "actorCount": 7,
          "sophistication": "advanced",
          "details": "Home to APT28, APT29, Sandworm, Turla, and other advanced persistent threat groups"
        },
        "cyberConflictHistory": {
          "score": 30,
          "incidentCount": 150,
          "severity": "critical",
          "details": "Extensive history of state-sponsored cyber operations including Ukraine power grid attacks, NotPetya, SolarWinds"
        },
        "criticalInfrastructureExposure": {
          "score": 18,
          "vulnerabilityLevel": "high",
          "details": "Significant critical infrastructure with known vulnerabilities, frequent targeting by adversaries"
        },
        "regulatoryEnvironment": {
          "score": 7,
          "maturity": "developing",
          "details": "Developing cybersecurity regulations, limited international cooperation"
        }
      },
      "events": [
        {
          "date": "2020-12-13",
          "title": "SolarWinds Supply Chain Attack",
          "description": "APT29 compromised SolarWinds Orion platform",
          "impact": "critical"
        },
        {
          "date": "2017-06-27",
          "title": "NotPetya Ransomware",
          "description": "Sandworm deployed destructive malware globally",
          "impact": "critical"
        },
        {
          "date": "2015-12-23",
          "title": "Ukraine Power Grid Attack",
          "description": "First known cyber attack on power grid",
          "impact": "critical"
        }
      ],
      "trends": {
        "direction": "increasing",
        "velocity": "moderate",
        "forecast": "Continued state-sponsored cyber operations expected, focus on critical infrastructure and supply chains"
      },
      "lastUpdated": "2025-11-01T00:00:00Z"
    },
    {
      "id": "CR-002",
      "name": "China",
      "code": "CN",
      "region": "Asia",
      "riskScore": 92,
      "riskLevel": "critical",
      "factors": {
        "threatActorPresence": {
          "score": 40,
          "actorCount": 5,
          "sophistication": "advanced",
          "details": "Home to APT41, APT10, APT1, and numerous other state-sponsored groups"
        },
        "cyberConflictHistory": {
          "score": 28,
          "incidentCount": 120,
          "severity": "critical",
          "details": "Long history of cyber espionage targeting intellectual property, government, and defense sectors"
        },
        "criticalInfrastructureExposure": {
          "score": 17,
          "vulnerabilityLevel": "high",
          "details": "Massive critical infrastructure footprint with increasing digitalization"
        },
        "regulatoryEnvironment": {
          "score": 7,
          "maturity": "developing",
          "details": "Strict domestic regulations, limited international transparency"
        }
      },
      "events": [
        {
          "date": "2020-09-16",
          "title": "Healthcare Sector Attacks",
          "description": "APT41 targeted healthcare organizations during COVID-19",
          "impact": "high"
        },
        {
          "date": "2018-12-20",
          "title": "Cloud Hopper Campaign",
          "description": "APT10 compromised managed service providers globally",
          "impact": "critical"
        },
        {
          "date": "2015-06-04",
          "title": "OPM Data Breach",
          "description": "Theft of 21.5 million personnel records",
          "impact": "critical"
        }
      ],
      "trends": {
        "direction": "increasing",
        "velocity": "rapid",
        "forecast": "Expanding cyber capabilities with focus on technology theft and strategic intelligence"
      },
      "lastUpdated": "2025-11-01T00:00:00Z"
    },
    {
      "id": "CR-003",
      "name": "North Korea",
      "code": "KP",
      "region": "Asia",
      "riskScore": 90,
      "riskLevel": "critical",
      "factors": {
        "threatActorPresence": {
          "score": 38,
          "actorCount": 3,
          "sophistication": "advanced",
          "details": "Lazarus Group, APT38, and other state-sponsored groups focused on financial gain and espionage"
        },
        "cyberConflictHistory": {
          "score": 28,
          "incidentCount": 80,
          "severity": "critical",
          "details": "Notable for WannaCry ransomware, Sony Pictures hack, SWIFT banking attacks"
        },
        "criticalInfrastructureExposure": {
          "score": 16,
          "vulnerabilityLevel": "medium",
          "details": "Limited critical infrastructure but highly isolated and vulnerable"
        },
        "regulatoryEnvironment": {
          "score": 8,
          "maturity": "minimal",
          "details": "Minimal cybersecurity regulations, state-controlled internet"
        }
      },
      "events": [
        {
          "date": "2017-05-12",
          "title": "WannaCry Ransomware",
          "description": "Global ransomware attack affecting 200,000+ computers",
          "impact": "critical"
        },
        {
          "date": "2016-02-05",
          "title": "Bangladesh Bank Heist",
          "description": "APT38 stole $81 million via SWIFT network",
          "impact": "critical"
        },
        {
          "date": "2014-11-24",
          "title": "Sony Pictures Hack",
          "description": "Destructive attack on Sony Pictures Entertainment",
          "impact": "high"
        }
      ],
      "trends": {
        "direction": "increasing",
        "velocity": "moderate",
        "forecast": "Continued focus on financial cybercrime to fund regime, cryptocurrency theft"
      },
      "lastUpdated": "2025-11-01T00:00:00Z"
    },
    {
      "id": "CR-004",
      "name": "Iran",
      "code": "IR",
      "region": "Middle East",
      "riskScore": 85,
      "riskLevel": "high",
      "factors": {
        "threatActorPresence": {
          "score": 35,
          "actorCount": 4,
          "sophistication": "high",
          "details": "APT33, APT34, OilRig, and other groups targeting critical infrastructure"
        },
        "cyberConflictHistory": {
          "score": 26,
          "incidentCount": 60,
          "severity": "high",
          "details": "History of destructive attacks on critical infrastructure, particularly energy sector"
        },
        "criticalInfrastructureExposure": {
          "score": 16,
          "vulnerabilityLevel": "high",
          "details": "Significant oil and gas infrastructure, frequent targeting by adversaries"
        },
        "regulatoryEnvironment": {
          "score": 8,
          "maturity": "emerging",
          "details": "Emerging cybersecurity framework, limited international cooperation"
        }
      },
      "events": [
        {
          "date": "2012-08-15",
          "title": "Shamoon Attacks",
          "description": "Destructive malware targeting Saudi Aramco",
          "impact": "critical"
        },
        {
          "date": "2019-06-20",
          "title": "US Drone Shootdown Retaliation",
          "description": "Cyber operations following military tensions",
          "impact": "medium"
        },
        {
          "date": "2020-05-09",
          "title": "Israeli Water Facility Attack",
          "description": "Attempted attack on water treatment facilities",
          "impact": "high"
        }
      ],
      "trends": {
        "direction": "increasing",
        "velocity": "moderate",
        "forecast": "Growing cyber capabilities with focus on regional adversaries and critical infrastructure"
      },
      "lastUpdated": "2025-11-01T00:00:00Z"
    },
    {
      "id": "CR-005",
      "name": "United States",
      "code": "US",
      "region": "North America",
      "riskScore": 75,
      "riskLevel": "high",
      "factors": {
        "threatActorPresence": {
          "score": 32,
          "actorCount": 2,
          "sophistication": "advanced",
          "details": "Home to Equation Group and other advanced capabilities, primary target of foreign APTs"
        },
        "cyberConflictHistory": {
          "score": 22,
          "incidentCount": 200,
          "severity": "high",
          "details": "Frequent target of state-sponsored attacks, extensive offensive capabilities"
        },
        "criticalInfrastructureExposure": {
          "score": 15,
          "vulnerabilityLevel": "high",
          "details": "Massive critical infrastructure footprint, frequent targeting by adversaries"
        },
        "regulatoryEnvironment": {
          "score": 6,
          "maturity": "advanced",
          "details": "Mature cybersecurity regulations, strong public-private partnerships"
        }
      },
      "events": [
        {
          "date": "2021-05-07",
          "title": "Colonial Pipeline Ransomware",
          "description": "DarkSide ransomware disrupted fuel supply",
          "impact": "critical"
        },
        {
          "date": "2020-12-13",
          "title": "SolarWinds Compromise",
          "description": "APT29 compromised government and private sector",
          "impact": "critical"
        },
        {
          "date": "2015-06-04",
          "title": "OPM Data Breach",
          "description": "Theft of 21.5 million personnel records",
          "impact": "critical"
        }
      ],
      "trends": {
        "direction": "stable",
        "velocity": "moderate",
        "forecast": "Continued targeting by nation-state actors, focus on critical infrastructure protection"
      },
      "lastUpdated": "2025-11-01T00:00:00Z"
    },
    {